{
  "manifestVersion": "0.1",
  "id": "org.workbench.example.mortgage-calc",
  "version": "0.1.0",
  "runtime": {
    "kind": "wasm-component",
    "interface": "org.workbench.component@0.1",
    "module": "logic.wasm",
    "sha256": "0000000000000000000000000000000000000000000000000000000000000000"
  },
  "metadata": "capabilities.ttl",
  "ui": "ui.json",
  "permissions": [],
  "ports": {
    "inputs": [
      {
        "name": "loan",
        "schema": "schemas/input.json",
        "semanticType": "https://workbench.example/ns/0.1#MortgageTerms"
      }
    ],
    "outputs": [
      {
        "name": "payment",
        "schema": "schemas/output.json",
        "semanticType": "https://workbench.example/ns/0.1#MortgagePayment",
        "unit": "https://workbench.example/ns/0.1#GBP"
      }
    ]
  },
  "evidence": [
    "evidence/tests.json"
  ]
}
